target,ids,date,flag,user,text
0,1.47E+09,Tue Apr 07 00:35:26 PDT 2009,NO_QUERY,IndieAnnie,Had a lovely day at the beach followed by dinner with a gorgeous lady ;) roll on the work today  Booo!
0,1.47E+09,Tue Apr 07 00:35:36 PDT 2009,NO_QUERY,itsjusttori,"@TyJaneTrev i agreee! clearly they only want attention, SORRY I COULDN'T CATCH THE TRAIN MATEEE "
0,1.47E+09,Tue Apr 07 00:35:39 PDT 2009,NO_QUERY,emmmmmmmmm,"i got smoke in my eyes, now they burn "
0,1.47E+09,Tue Apr 07 00:35:43 PDT 2009,NO_QUERY,waako,"Loves what #drupal file framework module could do, but is sick of Bitcache errors making it impossible to upload files "
0,1.47E+09,Tue Apr 07 00:35:47 PDT 2009,NO_QUERY,trishaberida,i feel lonely today.... 
0,1.47E+09,Tue Apr 07 00:35:49 PDT 2009,NO_QUERY,Pumpkinpopkin,@hebb I wish I could go to bed... 
0,1.47E+09,Tue Apr 07 00:35:50 PDT 2009,NO_QUERY,samanthaisbenny,Haha my house is creepy at night!!  It creaks and stuff..scary. lol..I'm gonna go to bed.
0,1.47E+09,Tue Apr 07 00:35:51 PDT 2009,NO_QUERY,jaybe81,can't upload my pic 
0,1.47E+09,Tue Apr 07 00:35:53 PDT 2009,NO_QUERY,kevinjy1980,ah..I hate flu..now its third day. guess what happened accidently I shaved my eye brows off. I need glasses 
0,1.47E+09,Tue Apr 07 00:35:54 PDT 2009,NO_QUERY,not_a_frog,@zackdft but i like reading the bullshit! 
0,1.47E+09,Tue Apr 07 00:36:00 PDT 2009,NO_QUERY,BrittniA,im so confused  This SUCKS!!!!!
0,1.47E+09,Tue Apr 07 00:36:00 PDT 2009,NO_QUERY,9020084,has to study math 4 econ but isnt in the mood 
0,1.47E+09,Tue Apr 07 00:36:06 PDT 2009,NO_QUERY,NewBread,"@MissCassandra StiLL on my &quot;Lions &amp; Tigers &amp; Bears&quot; shyt.............  but GOD is gOOd consequently, I wiLL be tOO"
0,1.47E+09,Tue Apr 07 00:36:12 PDT 2009,NO_QUERY,mcsteph94,why do other people get replies 
0,1.47E+09,Tue Apr 07 00:36:13 PDT 2009,NO_QUERY,misskle,"Damn stiff neck, day 2 "
0,1.47E+09,Tue Apr 07 00:36:14 PDT 2009,NO_QUERY,unicornanatomy,@djginaturner no le gusta house of house 5 min intro 
0,1.47E+09,Tue Apr 07 00:36:15 PDT 2009,NO_QUERY,EllieYoung,Missing the fab five 
0,1.47E+09,Tue Apr 07 00:36:20 PDT 2009,NO_QUERY,rdalba,@marcellariley it was a repeat tonight for Gossip Girl 
0,1.47E+09,Tue Apr 07 00:36:17 PDT 2009,NO_QUERY,carleensteele,is losing her hubby for a week tomorrow for work.  Easter and all 
0,1.47E+09,Tue Apr 07 00:36:18 PDT 2009,NO_QUERY,waivethesale,@HoptonHouseBnB I'm thinking of getting my old FM tuner from the garage as I'm having problems when my PC just stops playing audio 
0,1.47E+09,Tue Apr 07 00:36:30 PDT 2009,NO_QUERY,sezjoelwantsit,i want my money from kevo to hurry up 
0,1.47E+09,Tue Apr 07 00:36:30 PDT 2009,NO_QUERY,Maria_143,Anybody willing to help me??? I've been trying to make a sad tune on the piano for a new song but it always ends up happy and bright  ???
0,1.47E+09,Tue Apr 07 00:36:30 PDT 2009,NO_QUERY,lizlin,@bursaar Good for me. I haven't gone to bed... 
0,1.47E+09,Tue Apr 07 00:36:35 PDT 2009,NO_QUERY,CloverMay,baking oatmeal + chocolate chip cookies to make me tired.  i can't sleep 
0,1.47E+09,Tue Apr 07 00:36:34 PDT 2009,NO_QUERY,boogie_shoes,and so the editing of 3000 wedding shots begins 
0,1.47E+09,Tue Apr 07 00:36:43 PDT 2009,NO_QUERY,Reptar01,my facebook is Fucked. 
0,1.47E+09,Tue Apr 07 00:36:46 PDT 2009,NO_QUERY,Fatty_D,@KellyShibari i thought i saw you there! you were walking out the door when i saw you. 
0,1.47E+09,Tue Apr 07 00:36:51 PDT 2009,NO_QUERY,Babybandit,@derek319 @shwe370 sweet! That was fun... Except it stretched my browser... And I was watching Twit! 
0,1.47E+09,Tue Apr 07 00:37:07 PDT 2009,NO_QUERY,hungsika,Ads not yet appeared  Google Adsense Team said it may delay 48 hrs on http://womenissues.info
0,1.47E+09,Tue Apr 07 00:37:11 PDT 2009,NO_QUERY,TC_President,tired  i need a regular 9-5
0,1.47E+09,Tue Apr 07 00:37:20 PDT 2009,NO_QUERY,themainecanada,my dog is in my room SNORING! 
0,1.47E+09,Tue Apr 07 00:37:20 PDT 2009,NO_QUERY,LoftonRiser,Going to sleep... hoping to wake up and tommorow will be Wednesday instead of Tuesday... I really don't want to go to work 
0,1.47E+09,Tue Apr 07 00:37:22 PDT 2009,NO_QUERY,eve0887,@wtfanabel nite!! I still cant go to sleep. 
0,1.47E+09,Tue Apr 07 00:37:27 PDT 2009,NO_QUERY,ChrisScherer,Im such an insomniac this week 
0,1.47E+09,Tue Apr 07 00:37:33 PDT 2009,NO_QUERY,tizzle241,@alissa_rules Basically.  I feel like I need to take better care of myself after seeing that fool.  No more juicin' for me 
0,1.47E+09,Tue Apr 07 00:37:37 PDT 2009,NO_QUERY,danadearmond,still spitting out stitches from that bone graft 
0,1.47E+09,Tue Apr 07 00:37:39 PDT 2009,NO_QUERY,pleep,hooray for the ever so reliable signalflare server 
0,1.47E+09,Tue Apr 07 00:37:43 PDT 2009,NO_QUERY,shuttler,"Well that was a fun nights work, now to start the working day "
0,1.47E+09,Tue Apr 07 00:37:58 PDT 2009,NO_QUERY,yoyojustinfro,Sleepin. @skankityspence halo tonight before you leave 
0,1.47E+09,Tue Apr 07 00:38:03 PDT 2009,NO_QUERY,Lush_London,@Schofe not off the side of the bridge I hope? 
0,1.47E+09,Tue Apr 07 00:38:07 PDT 2009,NO_QUERY,jessa_almeida,watchin.. I'm not there. and missing heath ledger 
0,1.47E+09,Tue Apr 07 00:38:15 PDT 2009,NO_QUERY,tempeste,"@Indigored_hot  sorry your day was a waste, hope you found some good bits in it and YAY you are homeward bound."
0,1.47E+09,Tue Apr 07 00:38:17 PDT 2009,NO_QUERY,lainers895,"@awillert  im so jealous..i want salsa, but the cookies were AMAZING!"
0,1.47E+09,Tue Apr 07 00:38:30 PDT 2009,NO_QUERY,thepetshopboy,blip is &quot;under maintenance&quot; &amp; i'm goin' through withdrawel 
0,1.47E+09,Tue Apr 07 00:38:29 PDT 2009,NO_QUERY,HezzyRchild,"@MadNinjaCurl hey neighbor, neither can I "
0,1.47E+09,Tue Apr 07 00:38:37 PDT 2009,NO_QUERY,saragwin,@msJodiOdie its such a sad situation. Though 1-in-3 of us will be beaten. In US every 15 seconds &amp; 3 killed a day. It's sadly commonplace 
0,1.47E+09,Tue Apr 07 00:38:38 PDT 2009,NO_QUERY,ei8htyOne,and so the editing of 3000 wedding shots begins 
0,1.47E+09,Tue Apr 07 00:38:46 PDT 2009,NO_QUERY,vickydotin,Journalist throws shoe at Chidambaram  http://ibnlive.in.com/news/journalist-throws-shoe-at-chidambaram/89666-3.html
0,1.47E+09,Tue Apr 07 00:38:54 PDT 2009,NO_QUERY,stephenplynch,"starting to resent always being struck by creativity after midnight, then having to get up for work in the morning "
0,1.47E+09,Tue Apr 07 00:38:54 PDT 2009,NO_QUERY,feefers,What's the best way to eat reheated pizza I keep trying to eat this one but it's too hot and makes my mouth be in pain 
0,1.47E+09,Tue Apr 07 00:38:59 PDT 2009,NO_QUERY,ElmosSexy,Nothing was sick all day it sucked im just up late cant sleep 
0,1.47E+09,Tue Apr 07 00:39:01 PDT 2009,NO_QUERY,symee,Even with the best intentions i'm late for work again 
0,1.47E+09,Tue Apr 07 00:38:59 PDT 2009,NO_QUERY,Anna1968,"@Linda_James Thank you!! I spent ages on Thursday tidying up, then along came everyone and it looked like a right tip again "
0,1.47E+09,Tue Apr 07 00:38:59 PDT 2009,NO_QUERY,iliPahgz, Heroes is losing it's momentum ): come on writers pick it up!!!
0,1.47E+09,Tue Apr 07 00:39:09 PDT 2009,NO_QUERY,JackiiAngel,it�s so boring 
0,1.47E+09,Tue Apr 07 00:39:17 PDT 2009,NO_QUERY,hellonatalie,is back at work...Although I wish I was back in bed... 
0,1.47E+09,Tue Apr 07 00:39:40 PDT 2009,NO_QUERY,SER99,its sprained!!  so glad im on holidays
0,1.47E+09,Tue Apr 07 00:39:41 PDT 2009,NO_QUERY,_anthonyjames,"Stupid bus was early  I missed it. Stupid thing  Then I missed the bus after that.  Finally got a bus, then missed my second :'( gutz."
0,1.47E+09,Tue Apr 07 00:39:46 PDT 2009,NO_QUERY,Catmoo,"@MrNokill @MrNokill problem is they aren't appealing to a wide enough audience, even though they think they may be "
0,1.47E+09,Tue Apr 07 00:39:48 PDT 2009,NO_QUERY,jnarin,@AiyerChitra Yikes! Now i have no clues what to do! 
0,1.47E+09,Tue Apr 07 00:40:05 PDT 2009,NO_QUERY,tweetingbird27,I am engaged to muppet orlando and i just realised oh my god i cant marry Justin Timberlake 
0,1.47E+09,Tue Apr 07 00:40:26 PDT 2009,NO_QUERY,BaBy_N,gosh it`t 9:39 am and i am soooo tired &quot;yawn&quot; i want to go back to sleep but i can`t 
0,1.47E+09,Tue Apr 07 00:40:37 PDT 2009,NO_QUERY,CllrDaisyBenson,On the train sans Guardian 
0,1.47E+09,Tue Apr 07 00:40:38 PDT 2009,NO_QUERY,DesertCubist,Made it into DC on Saturday afternoon after 17 hours in air and am now in South FL...jetlag sucks!!  Haven't had a full sleep since Thurs 
0,1.47E+09,Tue Apr 07 00:40:41 PDT 2009,NO_QUERY,Nojman,"I'm at work, and I'm sick.. And its helluva lot todo. This blows. "
0,1.47E+09,Tue Apr 07 00:40:47 PDT 2009,NO_QUERY,nabilaqila,i am so screwed up! a confused and dumb child!  i NEVER felt so bad all my life! i wish i have any specialty! too bad i have none ='(
0,1.47E+09,Tue Apr 07 00:40:49 PDT 2009,NO_QUERY,convoy3571,Went to the doctor's today and my blood sugar level was 178. 
0,1.47E+09,Tue Apr 07 00:41:21 PDT 2009,NO_QUERY,Divi9elyCreated,gosh...it makes me sad when people don't give God a chance 
0,1.47E+09,Tue Apr 07 00:41:26 PDT 2009,NO_QUERY,Roses_Are_Red,"@kaylee110 *yawns* i'm pretty good, thanks, awww  i'm sorry to hear that! feel better soon &lt;3"
0,1.47E+09,Tue Apr 07 00:41:34 PDT 2009,NO_QUERY,__Ilse,@shelikescute that's so sad 
0,1.47E+09,Tue Apr 07 00:41:38 PDT 2009,NO_QUERY,MiDesfileNegro,It's 8:40am... I've been awake for nearly 2 hours 
0,1.47E+09,Tue Apr 07 00:41:44 PDT 2009,NO_QUERY,HNav,can't sleep. I don't like Sonny being gone. 
0,1.47E+09,Tue Apr 07 00:41:41 PDT 2009,NO_QUERY,eckorecord,Not drunk at all  @kirstiekalamity
0,1.47E+09,Tue Apr 07 00:41:45 PDT 2009,NO_QUERY,eunicecute,finally! updated...oohh I sooo miss the internet {sorry to say that woop2x may not open apr.10}  so how's it goin'??
0,1.47E+09,Tue Apr 07 00:41:45 PDT 2009,NO_QUERY,amazingphoebe,i miss @sebby_peek 
0,1.47E+09,Tue Apr 07 00:41:46 PDT 2009,NO_QUERY,Sholaa,"@dadi_iyal and you'll get familiar with twitter pretty soon!!! i'm not coming back this summer, so that means i dont even see you then?! "
0,1.47E+09,Tue Apr 07 00:41:48 PDT 2009,NO_QUERY,aarod,loves to get drunk... just not by himself 
0,1.47E+09,Tue Apr 07 00:41:53 PDT 2009,NO_QUERY,GirltaristHan,I have a hole in my favourite top. I bought it in the sale before Christmas so I can't even get an exchange  might try fixing it later.
0,1.47E+09,Tue Apr 07 00:41:58 PDT 2009,NO_QUERY,Naomi_Jaine,"feeling very poorly and sorry for myself. Can't swallow, ow  Stupid glands."
0,1.47E+09,Tue Apr 07 00:41:59 PDT 2009,NO_QUERY,kimoIK,@StreetWearBear.  yes I am thanks for reaveling to the world bro fuck my life hahaha
0,1.47E+09,Tue Apr 07 00:41:59 PDT 2009,NO_QUERY,rarrkun,@cherrytreerec I can't see anything  Stupid YouTube and their location restrictions. Who's in the Speedo?
0,1.47E+09,Tue Apr 07 00:42:02 PDT 2009,NO_QUERY,rsefuck,She now wants an mmmf except I have to only play a supporting role  would mind but the other two guys have huge cocks what am I to do? 
0,1.47E+09,Tue Apr 07 00:42:11 PDT 2009,NO_QUERY,OMGzorz,Banned from Sims Forums for the rest of the week. Aww    It feels weird. I was only sticking up for Chanel :'(
0,1.47E+09,Tue Apr 07 00:42:12 PDT 2009,NO_QUERY,annemarike,@willadam i treated myself to that latte after the appointment which was horrible. I need to have my wisdom teeth surgically removed 
0,1.47E+09,Tue Apr 07 00:42:18 PDT 2009,NO_QUERY,happymikipower,@CelesteChong oh but mine is ceramic so its more ex  abit less visible. inside ones are very ex! double the price n double the duration
0,1.47E+09,Tue Apr 07 00:42:21 PDT 2009,NO_QUERY,jasongaunt,"Dear Crimestoppers, thankyou for your regular service of our burglar alarm, I'm most grateful for the new 200dB ear-deafening entry tones "
0,1.47E+09,Tue Apr 07 00:42:23 PDT 2009,NO_QUERY,ValerieNichole,"All the fightin and name callin, i can still run 2 my sister!  nite..."
0,1.47E+09,Tue Apr 07 00:42:28 PDT 2009,NO_QUERY,Earytha,sick today  and i have a lot to do at work 
0,1.47E+09,Tue Apr 07 00:42:35 PDT 2009,NO_QUERY,t0ny7,Trying to find a tech job. Can't find any entry level jobs any were.  Also just about every job site has more spam now then jobs.
0,1.47E+09,Tue Apr 07 00:42:38 PDT 2009,NO_QUERY,DreamCharon,4 am insomnia is a BITCH 
0,1.47E+09,Tue Apr 07 00:42:38 PDT 2009,NO_QUERY,bri2003,just threw up all over the bathroom. not fun 
0,1.47E+09,Tue Apr 07 00:42:39 PDT 2009,NO_QUERY,markbrown83,off to work 
0,1.47E+09,Tue Apr 07 00:42:40 PDT 2009,NO_QUERY,BeccaSmalldon,Really hungry and sad that I had to throw my breakfast in the bin 
0,1.47E+09,Tue Apr 07 00:42:44 PDT 2009,NO_QUERY,Matches1,Oh darn...it's mandy creed isnt it @jordar @mikerra 
0,1.47E+09,Tue Apr 07 00:42:50 PDT 2009,NO_QUERY,maryanna03,i dont understand.  i didnt mean to break anyones heart. 
0,1.47E+09,Tue Apr 07 00:42:52 PDT 2009,NO_QUERY,turkish_lawyer,"Obama is visiting istanbul today, therefore all main roads have been closed  cause and effect !!!"
0,1.47E+09,Tue Apr 07 00:42:57 PDT 2009,NO_QUERY,badwulfstudio,"A lovely day, blazing sunshine.... too bad I have to work "
0,1.47E+09,Tue Apr 07 00:42:58 PDT 2009,NO_QUERY,maynot0703,"OMG my girl just woke me up, reason doesnt matter &amp; now I cant fall back to sleep  Gotta b up at 5 so maybe I'll just stay up. **sigh**"
0,1.47E+09,Tue Apr 07 00:43:03 PDT 2009,NO_QUERY,simonklaiber,"@viennateng Why didn't you tweet that you are in Germany, Heard about the concert in Marburg in the Radio 1 hour before it started. "
0,1.47E+09,Tue Apr 07 00:43:03 PDT 2009,NO_QUERY,AlanCayce,late night is all re-runs  http://ff.im/1Y02L
0,1.47E+09,Tue Apr 07 00:43:12 PDT 2009,NO_QUERY,mikolyn,just getting home...its snowing 
0,1.47E+09,Tue Apr 07 00:43:16 PDT 2009,NO_QUERY,chomma,@roxy_yeah yep a loser.  
0,1.47E+09,Tue Apr 07 00:43:22 PDT 2009,NO_QUERY,EvilSue,and finito! All bathroom contractors been thru the house. Quotes incoming then i need to bite the bullet 
0,1.47E+09,Tue Apr 07 00:43:26 PDT 2009,NO_QUERY,lexikitty,@caitlinaudrey awww!  that sucks! are you going to the sydney one?
0,1.47E+09,Tue Apr 07 00:43:29 PDT 2009,NO_QUERY,terrajen,"Sorry, SF. Rescheduling my SF trip for this coming weekend to mid May. Bad circumstances "
0,1.98E+09,Sun May 31 11:49:22 PDT 2009,NO_QUERY,TheSmyths,taking a short break between making mac &amp; cheese and getting ready for early Monday...up by 5 am!  aaaaaaaargh! out of house by 5:45 
4,1.47E+09,Mon Apr 06 22:22:45 PDT 2009,NO_QUERY,ersle,I LOVE @Health4UandPets u guys r the best!! 
4,1.47E+09,Mon Apr 06 22:22:45 PDT 2009,NO_QUERY,becca210,im meeting up with one of my besties tonight! Cant wait!!  - GIRL TALK!!
4,1.47E+09,Mon Apr 06 22:22:46 PDT 2009,NO_QUERY,Wingman29,"@DaRealSunisaKim Thanks for the Twitter add, Sunisa! I got to meet you once at a HIN show here in the DC area and you were a sweetheart. "
4,1.47E+09,Mon Apr 06 22:22:46 PDT 2009,NO_QUERY,katarinka,"Being sick can be really cheap when it hurts too much to eat real food  Plus, your friends make you soup"
4,1.47E+09,Mon Apr 06 22:22:46 PDT 2009,NO_QUERY,_EmilyYoung,@LovesBrooklyn2 he has that effect on everyone 
4,1.47E+09,Mon Apr 06 22:22:47 PDT 2009,NO_QUERY,ajarofalmonds,@ProductOfFear You can tell him that I just burst out laughing really loud because of that  Thanks for making me come out of my sulk!
4,1.47E+09,Mon Apr 06 22:22:51 PDT 2009,NO_QUERY,vmdavinci,@r_keith_hill Thans for your response. Ihad already find this answer 
4,1.47E+09,Mon Apr 06 22:22:48 PDT 2009,NO_QUERY,jessicavaliyi,"@KeepinUpWKris I am so jealous, hope you had a great time in vegas! how did you like the ACM's?! LOVE YOUR SHOW!! "
4,1.47E+09,Mon Apr 06 22:22:49 PDT 2009,NO_QUERY,emmasaur28,"@tommcfly ah, congrats mr fletcher for finally joining twitter "
4,1.47E+09,Mon Apr 06 22:22:49 PDT 2009,NO_QUERY,SherylBreuker,@e4VoIP I RESPONDED  Stupid cat is helping me type. Forgive errors 
4,1.47E+09,Mon Apr 06 22:22:49 PDT 2009,NO_QUERY,claaare,crazy day of school. there for 10 hours straiiight. about to watch the hills. @spencerpratt told me too! ha. happy birthday JB! 
4,1.47E+09,Mon Apr 06 22:22:49 PDT 2009,NO_QUERY,Hollywood_Trey,@naughtyhaughty HOW DID I FORGET ABOUT TWO AND A HALF MEN?!?!? I LOVE THAT SHOW!!! 
4,1.47E+09,Mon Apr 06 22:22:51 PDT 2009,NO_QUERY,JJLuver756,"@nileyjileyluver Haha, don't worry! You'll get the hang of it! "
4,1.47E+09,Mon Apr 06 22:22:52 PDT 2009,NO_QUERY,tophatdog,"@soundwav2010 At least I won't be the only one feeling lost! This may cause me many later than usual nights, already addicting "
4,1.47E+09,Mon Apr 06 22:22:53 PDT 2009,NO_QUERY,toothfairycyber,@LutheranLucciol Make sure you DM me if you post a link to that video! &lt;LOL&gt;So I don't miss it   Better get permission and blessing first?
4,1.47E+09,Mon Apr 06 22:22:54 PDT 2009,NO_QUERY,misstoriblack,Just added tweetie to my new iPhone 
4,1.47E+09,Mon Apr 06 22:22:58 PDT 2009,NO_QUERY,estariray,@michellardi i really don't know. i think its Globe!  yeah! sana gumaling na ko para alam ko na din kung makakasama ako! )
4,1.47E+09,Mon Apr 06 22:22:55 PDT 2009,NO_QUERY,ddjuli,@nicolerichie: your picture is very sweet 
4,1.47E+09,Mon Apr 06 22:22:57 PDT 2009,NO_QUERY,adamjackson,"Catching Up on Emails, RSS and Random BACN. Then I'm cutting out early tonight (11:30PM) to have Dinner with @lauraw "
4,1.47E+09,Mon Apr 06 22:22:56 PDT 2009,NO_QUERY,lightleaves,"Dancing around the room in Pjs, jamming to my ipod. Getting dizzy. Well twitter, you asked! "
4,1.47E+09,Mon Apr 06 22:22:56 PDT 2009,NO_QUERY,sorano916,Didn't place in the Peeps contest but thanks for voting anyways. 
4,1.47E+09,Mon Apr 06 22:22:57 PDT 2009,NO_QUERY,livelaughenjoy,Going to bed so goodnight everyone  and sweet dreams  http://twitpic.com/2y2e0
4,1.47E+09,Mon Apr 06 22:22:57 PDT 2009,NO_QUERY,rwang0,@LittleLumen walking over to put the deposit down tomorrow 
4,1.47E+09,Mon Apr 06 22:22:58 PDT 2009,NO_QUERY,oOLuciousLisaOo,"is now followinq @DAChesterFrench , you shud do tha same "
4,1.47E+09,Mon Apr 06 22:22:58 PDT 2009,NO_QUERY,mark_liu,@LordPov Are you meant to add on the back of that &quot;twittering from a toilet cubicle somewhere&quot;? 
4,1.47E+09,Mon Apr 06 22:22:58 PDT 2009,NO_QUERY,MissNikki22,Aw i'm holding my new puppy. Well He's not mine but He's a cutie. 
4,1.47E+09,Mon Apr 06 22:23:00 PDT 2009,NO_QUERY,anyyankeest,@iJohn kitteh is sleepin on my crotch which proves she likes me more 
4,1.47E+09,Mon Apr 06 22:23:02 PDT 2009,NO_QUERY,missmegs6,@DramaBeats agreed 
4,1.47E+09,Mon Apr 06 22:23:03 PDT 2009,NO_QUERY,gattermeier,reaching amritsar in an hour and (if i find a bus) should be at wagah border by 2pm  - http://bkite.com/06fuJ
4,1.47E+09,Mon Apr 06 22:23:05 PDT 2009,NO_QUERY,ClareStewart,@ALBinLA.  I was just thinking about you tonight!  You have to let me be the first to interview you're a famous super star 
4,1.47E+09,Mon Apr 06 22:23:06 PDT 2009,NO_QUERY,conniechiwa23,happy to spend time with the family. 
4,1.47E+09,Mon Apr 06 22:23:06 PDT 2009,NO_QUERY,kristenwolf,finally going to bed!  so tired. Was gonna watch The Hills but didnt =/
4,1.47E+09,Mon Apr 06 22:23:06 PDT 2009,NO_QUERY,Mackenzie2009,so effing tired of my throat hurting.... ooooohh... i just got a crazy craving for a pina colada/banana slushie!!!! 
4,1.47E+09,Mon Apr 06 22:23:07 PDT 2009,NO_QUERY,alderina,@deon upload di indowebster dong banggggg 
4,1.47E+09,Mon Apr 06 22:23:09 PDT 2009,NO_QUERY,AngryBadgerGirl,@wisdomous you're welcome. glad you enjoyed it. 
4,1.47E+09,Mon Apr 06 22:23:09 PDT 2009,NO_QUERY,roxy_barbosa,@hawaii808shellz hAhAHA!! omG! we wer bOth laughiN off d hOOk!  cuz das hOW we roLLL...ryt sheLdawg?
4,1.47E+09,Mon Apr 06 22:23:12 PDT 2009,NO_QUERY,LydiaCaesar,@SickWithThePen awww pookie feel better. I'll pray for you...and BAG the nurse up 
4,1.47E+09,Mon Apr 06 22:23:10 PDT 2009,NO_QUERY,loveshine,YAY! found a new cuddle buddy 
4,1.47E+09,Mon Apr 06 22:23:11 PDT 2009,NO_QUERY,PamelaPJA,I think I met my first &quot;snob&quot; on twitter tonight. Too bad. Life goes on! 
4,1.47E+09,Mon Apr 06 22:23:12 PDT 2009,NO_QUERY,andwhenyousing,Across the Universe. Sleep. Rehearsal tomorrow. 
4,1.47E+09,Mon Apr 06 22:23:14 PDT 2009,NO_QUERY,subwaystory,"@annabellee dry sweet potato, huh? "
4,1.47E+09,Mon Apr 06 22:23:13 PDT 2009,NO_QUERY,Dori23,"@JonathanRKnight Hi Jon! Great to hear from you! See you on the cruise, I cannot wait! Hope all is well on the Knight bus!  You are loved!"
4,1.47E+09,Mon Apr 06 22:23:16 PDT 2009,NO_QUERY,lykyeah,having a long conversation with mom on phone 
4,1.47E+09,Mon Apr 06 22:23:14 PDT 2009,NO_QUERY,amyg0716,@suitelifeofkell yayyy! lol. i just requested herrr. what did she say? 
4,1.47E+09,Mon Apr 06 22:23:15 PDT 2009,NO_QUERY,Eric_John,Practicing lines/mannerisms/voices for upcoming feature shoot.  Probably driving Brock crazy.  
4,1.47E+09,Mon Apr 06 22:23:16 PDT 2009,NO_QUERY,JustZGirl,Going to go and read new moon for the 3rd time  I cant get enough of twilight series 
4,1.47E+09,Mon Apr 06 22:23:17 PDT 2009,NO_QUERY,zubatnpsyduck,today is our two month anniversary!!! i love you sooooooo much Diana. omg you dont even know  TAR HEELS WON THE NCAA WOOT!!!!!
4,1.47E+09,Mon Apr 06 22:23:18 PDT 2009,NO_QUERY,Toyia1,I am bored 
4,1.47E+09,Mon Apr 06 22:23:19 PDT 2009,NO_QUERY,deeper2k,@stevecla it is a wallpaper with Red Square I was asking for 
4,1.47E+09,Mon Apr 06 22:23:20 PDT 2009,NO_QUERY,vmdavinci,@r_keith_hill Thanks for your response. Ihad already find this answer 
4,1.47E+09,Mon Apr 06 22:23:20 PDT 2009,NO_QUERY,Missy_BB,@Pope_Mello Well yeah! I only noticed cuz i'm BB too. 
4,1.47E+09,Mon Apr 06 22:23:20 PDT 2009,NO_QUERY,EmCDL,Just tryna get inspired thats all 
4,1.47E+09,Mon Apr 06 22:23:21 PDT 2009,NO_QUERY,Jenshwa,@KourtneyKardash Can't get up early enough!!!  Night workouts are much better. 
4,1.47E+09,Mon Apr 06 22:23:21 PDT 2009,NO_QUERY,swirlicious,"@ladygaga Can't wait to see ur hot ass in Austin! woot woot!!! annnd love the bob with purple, i went the royal color way as well "
4,1.47E+09,Mon Apr 06 22:23:21 PDT 2009,NO_QUERY,MrsMcMahon,"@QuotableBuffy I got a bunch of Buffy songs too! One of my faves is &quot;Vivian&quot; by Nerf Herder, when Faith met Spike in Buffy's body. "
4,1.47E+09,Mon Apr 06 22:23:21 PDT 2009,NO_QUERY,Yosid,#Devunity Wallpaper  Check this out !   --&gt;    http://twitpic.com/2y2e2
4,1.47E+09,Mon Apr 06 22:23:22 PDT 2009,NO_QUERY,SeanDB1,"Morning Tweetland, a long day ahead! Hope everyone has a great day  "
4,1.47E+09,Mon Apr 06 22:23:22 PDT 2009,NO_QUERY,BOSSAJUSTii,   uploading pictures on friendster 
4,1.47E+09,Mon Apr 06 22:23:23 PDT 2009,NO_QUERY,laurakim123,@ash_CT Aw dont you love that  I love for those days! Thanks about the pic ;-p
4,1.47E+09,Mon Apr 06 22:23:25 PDT 2009,NO_QUERY,tylerjamesberry,noodlebox with amanda tonight 
4,1.47E+09,Mon Apr 06 22:23:25 PDT 2009,NO_QUERY,suitelifeofkell,"@una_avion2010 Sorrry, I'm doing like 29823782 different things. Kevin Jonas' Girlfriend "
4,1.47E+09,Mon Apr 06 22:23:25 PDT 2009,NO_QUERY,msclace,@fuzeb they are so serious too while singing like.. whoa  hehe lsd maybe? j/k lolol
4,1.47E+09,Mon Apr 06 22:23:26 PDT 2009,NO_QUERY,KrystalHolmgren,loving life... and loving you 
4,1.47E+09,Mon Apr 06 22:23:26 PDT 2009,NO_QUERY,danlopez2012,@ApothecaryJeri  I love Sicilians best damn pizza on the planet [says I] 
4,1.47E+09,Mon Apr 06 22:23:27 PDT 2009,NO_QUERY,celiacbabe,loves chocolate milk  and that is GF YEAH..
4,1.47E+09,Mon Apr 06 22:23:28 PDT 2009,NO_QUERY,big_ol_d,Going to Sutter Creek tomorrow to tour an old Mine 
4,1.47E+09,Mon Apr 06 22:23:28 PDT 2009,NO_QUERY,Dixwifey,"@bodycoach I'll look into that cho, I personally like strawberry but I'm going to become coach soon "
4,1.47E+09,Mon Apr 06 22:23:29 PDT 2009,NO_QUERY,sammichfelge,"@little__fish guess where i live. the other side of the earth  east mesa, losiento"
4,1.47E+09,Mon Apr 06 22:23:30 PDT 2009,NO_QUERY,FunkySilla,@paula_paige3489 so apart from the sore... how was the tryouts? 
4,1.47E+09,Mon Apr 06 22:23:30 PDT 2009,NO_QUERY,nicole_land,failed physics TEST... what a homo. keeen for the holidays (2 days to go) 
4,1.47E+09,Mon Apr 06 22:23:31 PDT 2009,NO_QUERY,softwebchicago,"Just observed the update look of #Alexa website, http://tinyurl.com/c48gzf , looks great, seems Alexa is improving "
4,1.47E+09,Mon Apr 06 22:23:31 PDT 2009,NO_QUERY,bonk_onthehead,@leiabox so what can you tell us about it? I'm totally geeking out right now 
4,1.47E+09,Mon Apr 06 22:23:34 PDT 2009,NO_QUERY,Maeny,"@theragingocean BonJour Spacecowboy,I wish I was either of it .I work with Kids, can go out whenever I want and go wherever I want to "
4,1.47E+09,Mon Apr 06 22:23:35 PDT 2009,NO_QUERY,timTech,@Rebecca1158 goodnight. 
4,1.47E+09,Mon Apr 06 22:23:33 PDT 2009,NO_QUERY,AlwaysMiley,My brother is sick too lol. Quite weird 
4,1.47E+09,Mon Apr 06 22:23:34 PDT 2009,NO_QUERY,LadyErlynne,@drdrew *gives a hug and a cookie* Hope you feel better! 
4,1.47E+09,Mon Apr 06 22:23:34 PDT 2009,NO_QUERY,blockhead78Dawn,@jonathanRKnight Hey Jon! It's real and I hope you take care of yourself...we don't want you to get too rundown.  ((Hugs))
4,1.47E+09,Mon Apr 06 22:23:35 PDT 2009,NO_QUERY,mizzamanda,"Just wrote on a toilet wall... but only to correct poor spelling. And in highlighter, so it will wash off. HARDCORE "
4,1.47E+09,Mon Apr 06 22:23:35 PDT 2009,NO_QUERY,atsung,had a good tech meeting at clubZone - dinner was sushi 
4,1.47E+09,Mon Apr 06 22:23:36 PDT 2009,NO_QUERY,Scyranth,@mattgalloway Thanks for the hook up with @CarlyRush and suggesting me again bro! you rock! 
4,1.47E+09,Mon Apr 06 22:23:36 PDT 2009,NO_QUERY,skinnylatte,@jeffswarens depends on which version they thought you  the one I know doesn't go like that ;)
